[
  {
    "id": "yt-2026-09-04-01",
    "title": "Оперативная обстановка на фронте: анализ продвижения и разбор ключевых участков ЛБС",
    "channel": "Military Summary",
    "published_at": "2026-09-04T05:00:00.000Z",
    "duration": "18:24",
    "tags": ["ЛБС", "Покровск", "Торецк", "Сводка", "OSINT"],
    "why_watch": "Подробный тактический обзор текущей линии боевого соприкосновения с топографической привязкой к высотам и опорным пунктам.",
    "why_watch_uk": "Детальний тактичний огляд поточної лінії бойового зіткнення з топографічною прив'язкою до висот та опорних пунктів.",
    "why_watch_en": "Detailed tactical review of current frontline positioning with topographic mapping of dominant heights.",
    "url": "https://www.youtube.com/watch?v=2ZyClkzfSJo",
    "embed_id": "2ZyClkzfSJo",
    "score": {
      "total": 93.0,
      "relevance": 0.95,
      "source_quality": 0.92,
      "freshness": 0.96,
      "info_density": 0.90,
      "diversity": 0.86
    }
  },
  {
    "id": "yt-2026-09-04-02",
    "title": "Фронтовой обзор: тактическое маневрирование и удержание рубежей обороны",
    "channel": "Military Summary & Frontline Review",
    "published_at": "2026-09-04T03:30:00.000Z",
    "duration": "14:15",
    "tags": ["Часов Яр", "Купянск", "Канал", "Геолокация"],
    "why_watch": "Картографическая фиксация изменений рубежей контроля и анализ динамики боевых действий за последние сутки.",
    "why_watch_uk": "Картографічна фіксація змін рубежів контролю та аналіз динаміки бойових дій за останню добу.",
    "why_watch_en": "Cartographic tracking of control line shifts and tactical battlefield dynamics over the last 24 hours.",
    "url": "https://www.youtube.com/watch?v=XmPywH8VWFs",
    "embed_id": "XmPywH8VWFs",
    "score": {
      "total": 89.7,
      "relevance": 0.92,
      "source_quality": 0.88,
      "freshness": 0.94,
      "info_density": 0.85,
      "diversity": 0.82
    }
  },
  {
    "id": "yt-2026-09-04-03",
    "title": "Карта боевых действий: динамика изменения линии фронта и ключевые высоты",
    "channel": "Карта боевых действий & OSINT",
    "published_at": "2026-09-04T02:00:00.000Z",
    "duration": "11:50",
    "tags": ["Карта", "Фронт", "Аналитика", "Опорные пункты"],
    "why_watch": "Разбор динамики перемещения опорных пунктов и рубежей на ключевых направлениях боевого соприкосновения.",
    "why_watch_uk": "Аналіз динаміки переміщення опорних пунктів та рубежів на ключових напрямках бойового зіткнення.",
    "why_watch_en": "Detailed sector breakdown of fortification shifts along principal areas of engagement.",
    "url": "https://www.youtube.com/watch?v=ot_RDBihF18",
    "embed_id": "ot_RDBihF18",
    "score": {
      "total": 86.5,
      "relevance": 0.88,
      "source_quality": 0.86,
      "freshness": 0.90,
      "info_density": 0.82,
      "diversity": 0.80
    }
  },
  {
    "id": "yt-2026-09-04-04",
    "title": "Анализ рубежей и укрепрайонов: позиционные бои и применение БПЛА",
    "channel": "Tactical GeoSpatial Analysis",
    "published_at": "2026-09-03T21:45:00.000Z",
    "duration": "15:10",
    "tags": ["БПЛА", "РЭБ", "Позиции", "Оборона"],
    "why_watch": "Анализ применения разведывательных и ударных дронов при штурме и удержании опорных пунктов.",
    "why_watch_uk": "Аналіз застосування розвідувальних та ударних дронів при штурмі та утриманні опорних пунктів.",
    "why_watch_en": "Technical evaluation of reconnaissance and strike drone integration during tactical point defense.",
    "url": "https://www.youtube.com/watch?v=nBK8azWDgsY",
    "embed_id": "nBK8azWDgsY",
    "score": {
      "total": 84.2,
      "relevance": 0.85,
      "source_quality": 0.84,
      "freshness": 0.88,
      "info_density": 0.80,
      "diversity": 0.78
    }
  }
]
